<?xml version="1.0" encoding="UTF-8"?>
<!DOCTYPE modes SYSTEM "modes.dtd">

<modes>
  <aerosol id="sol_ait">
    <kind type="char">2mom</kind>
    <d_gn type="real">0.01E-6</d_gn>
    <sigma_g type="real">1.7</sigma_g>
    <shift2larger type="char">sol_acc</shift2larger>
    <shift_diam type="real">0.03E-6</shift_diam>
    <condensation type="int">1</condensation>
    <icoag type="int">1</icoag>
    <lut_optics type="char">inorg_ait</lut_optics>
  </aerosol>
  <aerosol id="sol_acc">
    <kind type="char">2mom</kind>
    <d_gn type="real">0.2E-6</d_gn>
    <sigma_g type="real">2.0</sigma_g>
    <condensation type="int">1</condensation>
    <icoag type="int">1</icoag>
    <lut_optics type="char">inorg_acc</lut_optics>
  </aerosol>
  <aerosol id="insol_acc">
    <kind type="char">2mom</kind>
    <d_gn type="real">0.2E-6</d_gn>
    <sigma_g type="real">2.0</sigma_g>
    <condensation type="int">1</condensation>
    <shift2mixed type="char">mixed_acc</shift2mixed>
    <icoag type="int">1</icoag>
    <lut_optics type="char">ash_acc</lut_optics>
  </aerosol>
  <aerosol id="mixed_acc">
    <kind type="char">2mom</kind>
    <d_gn type="real">0.2E-6</d_gn>
    <sigma_g type="real">2.</sigma_g>
    <condensation type="int">1</condensation>
    <icoag type="int">1</icoag>
    <lut_optics type="char">icoat15_ash_acc</lut_optics>
  </aerosol>
  <aerosol id="insol_coa">
    <kind type="char">2mom</kind>
    <d_gn type="real">2.0E-6</d_gn>
    <sigma_g type="real">2.2</sigma_g>
    <condensation type="int">1</condensation>
    <shift2mixed type="char">mixed_coa</shift2mixed>
    <icoag type="int">1</icoag>
    <lut_optics type="char">ash_coa</lut_optics>
  </aerosol>
  <aerosol id="mixed_coa">
    <kind type="char">2mom</kind>
    <d_gn type="real">2.0E-6</d_gn>
    <sigma_g type="real">2.2</sigma_g>
    <condensation type="int">1</condensation>
    <icoag type="int">1</icoag>
    <lut_optics type="char">icoat15_ash_coa</lut_optics>
  </aerosol>
  <aerosol id="giant">
    <kind type="char">2mom</kind>
    <d_gn type="real">1.200E-5</d_gn>
    <sigma_g type="real">2.0</sigma_g>
    <condensation type="int">0</condensation>
    <icoag type="int">0</icoag>
    <lut_optics type="char">ash_giant</lut_optics>
  </aerosol>
</modes>
