<?xml version="1.0" encoding="UTF-8"?>
<!DOCTYPE modes SYSTEM "modes.dtd">

<modes>
  <aerosol id="dusta">
    <kind    type="char">2mom</kind>
    <d_gn    type="real">6.445E-7</d_gn>
    <d_gm    type="real">1.500E-6</d_gm>
    <sigma_g type="real">1.700E+0</sigma_g>
    <rho     type="real">2.650E+3</rho>
    <condensation type="int">0</condensation>
    <icoag type="int">0</icoag>
    <lut_optics type="char" cvar_dia="true">dust_a</lut_optics>
  </aerosol>
  <aerosol id="dustb">
    <kind    type="char">2mom</kind>
    <d_gn    type="real">3.454E-6</d_gn>
    <d_gm    type="real">6.700E-6</d_gm>
    <sigma_g type="real">1.600E+0</sigma_g>
    <rho     type="real">2.650E+3</rho>
    <condensation type="int">0</condensation>
    <icoag type="int">0</icoag>
    <lut_optics type="char" cvar_dia="true">dust_b</lut_optics>
  </aerosol>
  <aerosol id="dustc">
    <kind    type="char">2mom</kind>
    <d_gn    type="real">8.672E-6</d_gn>
    <d_gm    type="real">1.420E-5</d_gm>
    <sigma_g type="real">1.500E+0</sigma_g>
    <rho     type="real">2.650E+3</rho>
    <condensation type="int">0</condensation>
    <icoag type="int">0</icoag>
    <lut_optics type="char" cvar_dia="true">dust_c</lut_optics>
  </aerosol>
</modes>
